Application name,Description,Application Url,Rank,Page.no 
App Name:SumatraPDF, Description:Sumatra PDF is a slim, free, open-source PDF/DjVu/EPUB/XPS/CHM/CBR/CBZ/MOBI/FB2 viewer for Windows.Why another PDF reader?,App URL: https://alternativeto.net/software/sumatra-pdf/,Page Rank:1,Website Page No:3 
App Name:calibre, Description:Calibre is a free and open source e-book library management application made by users, for users. Many languages, designed around the concept of the logical book, i.e.,App URL: https://alternativeto.net/software/calibre/,Page Rank:2,Website Page No:3 
App Name:Blender, Description:Blender is the free and open-source 3D creation suite. It supports the entirety of the 3D pipeline—modeling, rigging, animation, simulation, rendering, compositing, video editing, and motion tracking.,App URL: https://alternativeto.net/software/blender/,Page Rank:3,Website Page No:3 
App Name:Tor Browser, Description:The Tor software protects you by bouncing your communications around a distributed network of relays run by volunteers all around the world: it prevents somebody watching your...,App URL: https://alternativeto.net/software/tor-browser/,Page Rank:4,Website Page No:3 
App Name:KeePass, Description:A free and open source password manager that keeps all of your passwords safe in one place.,App URL: https://alternativeto.net/software/keepass/,Page Rank:5,Website Page No:3 
App Name:Brave, Description:Brave Web Browser is a fast, free, secure web browser with a built-in ad blocker*, tracking and security protection, and optimized data and battery experience.,App URL: https://alternativeto.net/software/brave/,Page Rank:6,Website Page No:3 
App Name:Sublime Text, Description:Sublime Text is a sophisticated text editor for code, html and prose - any kind of text file. You'll love the slick user interface and extraordinary features.,App URL: https://alternativeto.net/software/sublime-text/,Page Rank:7,Website Page No:3 
App Name:Vivaldi, Description:The Vivaldi browser protects you from trackers, blocks unwanted ads, and puts you in control with unique built-in features. .,App URL: https://alternativeto.net/software/vivaldi-browser/,Page Rank:8,Website Page No:3 
App Name:Element, Description:A free instant messaging and collaboration software based on the Matrix protocol.,App URL: https://alternativeto.net/software/riot-im/,Page Rank:9,Website Page No:3 
App Name:LibreOffice - Writer, Description:Writer has all the features you need from a modern, full-featured word processing or desktop publishing tool.,App URL: https://alternativeto.net/software/libreoffice-writer/,Page Rank:10,Website Page No:3 
App Name:ShareX, Description:ShareX is a free and open source program that lets you capture or record any area of your screen and share it with a single press of a key. It also allows uploading images, text or other types of files to over 80 supported destinations.,App URL: https://alternativeto.net/software/sharex/,Page Rank:11,Website Page No:3 
App Name:WordPress, Description:WordPress is open source software you can use to create a beautiful website, blog, or app.,App URL: https://alternativeto.net/software/wordpress/,Page Rank:12,Website Page No:3 
App Name:Adobe Photoshop, Description:The standard in professional image editing and compositing for creative design work.,App URL: https://alternativeto.net/software/adobe-photoshop/,Page Rank:13,Website Page No:3 
App Name:Kodi, Description:Kodi, formerly XBMC, is a free and open source media player and entertainment center for Linux, Mac OS X, Windows, XBox, and iOS.,App URL: https://alternativeto.net/software/xbmc-media-center/,Page Rank:14,Website Page No:3 
App Name:Trello, Description:Infinitely flexible. Incredibly easy to use. Great mobile apps. It's free. Trello keeps track of everything, from the big picture to the minute details.,App URL: https://alternativeto.net/software/trello/,Page Rank:15,Website Page No:3 
App Name:GitHub, Description:GitHub is a web-based hosting service for projects that use the Git revision control system.,App URL: https://alternativeto.net/software/github/,Page Rank:1,Website Page No:2 
App Name:Audacity, Description:Audacity is a free, open source, and cross-platform audio and music editor.,App URL: https://alternativeto.net/software/audacity/,Page Rank:2,Website Page No:2 
App Name:Discord, Description:Discord is about giving people the power to create belonging in their lives. We want to make it easier for you to talk regularly with the people you care about.,App URL: https://alternativeto.net/software/discord-app/,Page Rank:3,Website Page No:2 
App Name:Steam, Description:Steam is a digital distribution, digital rights management, multiplayer and communications platform developed by Valve Corporation.,App URL: https://alternativeto.net/software/steam/,Page Rank:4,Website Page No:2 
App Name:HandBrake, Description:Convert videos to formats that work on your mobile phone, tablet, TV media player, game console, computer, or web browser.,App URL: https://alternativeto.net/software/handbrake/,Page Rank:5,Website Page No:2 
App Name:Google Drive, Description:Google Drive is a file storage and synchronization service which enables user cloud storage, file sharing and collaborative editing.,App URL: https://alternativeto.net/software/google-drive/,Page Rank:6,Website Page No:2 
App Name:Ubuntu, Description:Ubuntu is a Debian Linux-based open source operating system for desktop computers.,App URL: https://alternativeto.net/software/ubuntu/,Page Rank:7,Website Page No:2 
App Name:Krita, Description:Professional, open-source raster graphics editor with advanced digital painting and sketching tools and workflow features.,App URL: https://alternativeto.net/software/krita/,Page Rank:8,Website Page No:2 
App Name:Spotify, Description:Spotify is a freemium music streaming service providing digital rights management-restricted content from record labels including Sony, EMI, Warner Music Group and Universal. ,App URL: https://alternativeto.net/software/spotify/,Page Rank:9,Website Page No:2 
App Name:TeamViewer, Description:TeamViewer lets you establish a connection to any PC or server within just a few seconds.,App URL: https://alternativeto.net/software/teamviewer/,Page Rank:10,Website Page No:2 
App Name:Atom, Description:Extensible, cross-platform text editor with a rich ecosystem of plugins and themes.,App URL: https://alternativeto.net/software/atom/,Page Rank:11,Website Page No:2 
App Name:Nextcloud, Description:A safe home for all your data – Access & share your files, calendars, contacts, mail & more from any device, on your terms.,App URL: https://alternativeto.net/software/nextcloud/,Page Rank:12,Website Page No:2 
App Name:Tor, Description:Tor is free software and an open network that helps you defend against traffic analysis, a form of network surveillance that threatens personal freedom and privacy, confidential business activities and relationships, and state security.,App URL: https://alternativeto.net/software/tor/,Page Rank:13,Website Page No:2 
App Name:Signal, Description:TextSecure and RedPhone have been merged to create Signal!,App URL: https://alternativeto.net/software/signal-private-messenger/,Page Rank:14,Website Page No:2 
App Name:OBS Studio, Description:Full-featured screen recording and live streaming software for Mac, Windows and Linux.,App URL: https://alternativeto.net/software/open-broadcaster-software/,Page Rank:15,Website Page No:2 
App Name:Evernote, Description:Evernote is a cross-platform, freemium app designed for note taking, organizing, and archiving.,App URL: https://alternativeto.net/software/evernote/,Page Rank:1,Website Page No:5 
App Name:Syncthing, Description:Syncthing replaces proprietary sync and cloud services with something open, trustworthy and decentralized. Your data is your data alone and you deserve to choose where it is stored.,App URL: https://alternativeto.net/software/syncthing/,Page Rank:2,Website Page No:5 
App Name:LastPass, Description:Password Manager, Auto Form Filler, Random Password Generator & Secure Digital Wallet App.,App URL: https://alternativeto.net/software/lastpass/,Page Rank:3,Website Page No:5 
App Name:BleachBit, Description:BleachBit deletes unnecessary files to free valuable disk space, maintain privacy, and remove junk. ,App URL: https://alternativeto.net/software/bleachbit/,Page Rank:4,Website Page No:5 
App Name:WinDirStat, Description:WinDirStat is a disk usage statistics viewer and cleanup tool, inspired by KDirStat.,App URL: https://alternativeto.net/software/windirstat/,Page Rank:5,Website Page No:5 
App Name:Kdenlive, Description:Kdenlive is an intuitive and powerful multi-track video editor compatible most recent video technologies. It is completely free, and open-source as defined by the GNU foundation.,App URL: https://alternativeto.net/software/kdenlive/,Page Rank:6,Website Page No:5 
App Name:Git, Description:Git is a free & open source, distributed version control system designed to handle everything from small to very large projects with speed and efficiency.,App URL: https://alternativeto.net/software/git/,Page Rank:7,Website Page No:5 
App Name:Paint.NET, Description:Paint.net is a free and very capable image editing software for Windows. Great alternative to Photoshop for people that do not need all the stuff PS offers.,App URL: https://alternativeto.net/software/paintnet/,Page Rank:8,Website Page No:5 
App Name:diagrams.net, Description:diagrams.net (previously draw.io) is a free online diagram drawing application for workflow, BPM, org charts, UML, ER, network diagrams.,App URL: https://alternativeto.net/software/diagramly/,Page Rank:9,Website Page No:5 
App Name:KeePassXC, Description:KeePass Cross-Platform Community Edition - A community maintained fork of the popular KeePassX application with more features and frequent updates.,App URL: https://alternativeto.net/software/keepassxc/,Page Rank:10,Website Page No:5 
App Name:Slack, Description:Real-time messaging, archiving and search for modern teams to stay focused and productive.,App URL: https://alternativeto.net/software/slack/,Page Rank:11,Website Page No:5 
App Name:Microsoft OneNote, Description:A digital notebook application that gives people one place to gather notes and information. .,App URL: https://alternativeto.net/software/microsoft-onenote/,Page Rank:12,Website Page No:5 
App Name:FileZilla, Description:FileZilla is a powerful FTP-client. It has been designed for ease of use and with support for as many features as possible, while still being fast and reliable.,App URL: https://alternativeto.net/software/filezilla/,Page Rank:13,Website Page No:5 
App Name:foobar2000, Description:foobar2000 is an advanced freeware audio player for the Windows platform.Main features,App URL: https://alternativeto.net/software/foobar2000/,Page Rank:14,Website Page No:5 
App Name:MPC-HC, Description:MPC-HC is an extremely light-weight, open source media player for Windows. It supports all common video and audio file formats available for playback.,App URL: https://alternativeto.net/software/mpc-hc/,Page Rank:15,Website Page No:5 
App Name:Google Keep, Description:Google Keep has several features including color coding notes, inserting images, creating lists, geo-fencing, shareable notes, and search by color.,App URL: https://alternativeto.net/software/google-keep/,Page Rank:1,Website Page No:4 
App Name:Bitwarden, Description:Bitwarden is the easiest and safest way to store your logins and passwords across all of your devices (iOS, Android, Chrome, Firefox, Opera, Windows, Mac, Linux, and more). Bitwarden is FREE and open source.,App URL: https://alternativeto.net/software/bitwarden--free-password-manager/,Page Rank:2,Website Page No:4 
App Name:balenaEtcher, Description:balenaEtcher is a free and open-source image burner with support for Windows, macOS and GNU/Linux. It makes USB and SD card image burning as simple and fast as possible.,App URL: https://alternativeto.net/software/etcher/,Page Rank:3,Website Page No:4 
App Name:f.lux, Description:Software that makes the color of your computer's display adapt to the time of day, warm at night and like sunlight during the day.,App URL: https://alternativeto.net/software/f-lux/,Page Rank:4,Website Page No:4 
App Name:Python, Description:Python is an interpreted, interactive, object-oriented, extensible programming language.,App URL: https://alternativeto.net/software/python/,Page Rank:5,Website Page No:4 
App Name:MEGA, Description:MEGA, the successor of MegaUpload , is a cloud storage and file hosting service produced by Mega Limited.,App URL: https://alternativeto.net/software/mega/,Page Rank:6,Website Page No:4 
App Name:CCleaner, Description:Cleaner tool for your system - protects your privacy, makes your computer faster and more secure.,App URL: https://alternativeto.net/software/ccleaner/,Page Rank:7,Website Page No:4 
App Name:Opera, Description:Opera is an innovative browser that focus on implementing new technologies without dropping simplicity and ease of use, speed and security; supporting and contributing to open web...,App URL: https://alternativeto.net/software/opera/,Page Rank:8,Website Page No:4 
App Name:Skype, Description:An instant messaging app that provides online text message and video chat services.,App URL: https://alternativeto.net/software/skype/,Page Rank:9,Website Page No:4 
App Name:Chromium, Description:Chromium is the open-source browser project from which Google Chrome takes its source.,App URL: https://alternativeto.net/software/chromium/,Page Rank:10,Website Page No:4 
App Name:Debian, Description:WHAT is Debian?
The Debian Project is an association of individuals who have made common cause to create a free operating system. This operating system that we have created is c...,App URL: https://alternativeto.net/software/debian/,Page Rank:11,Website Page No:4 
App Name:Everything, Description:File and folder lookup tool that searches across local, removable, and network mapped drives.,App URL: https://alternativeto.net/software/everything/,Page Rank:12,Website Page No:4 
App Name:Vim, Description:Vim ("Vi IMproved") is an advanced text editor that allows syntax highlighting, word completion and has a huge amount of contributed content. It also has a GUI version called GVim.,App URL: https://alternativeto.net/software/vim/,Page Rank:13,Website Page No:4 
App Name:Transmission, Description:Transmission has the features you expect in a BitTorrent client: encryption, a web-based interface, peer exchange, UPnP and NAT-PMP port forwarding, web seed support, watch...,App URL: https://alternativeto.net/software/transmission/,Page Rank:14,Website Page No:4 
App Name:Joplin, Description:An open source note taking and to-do application with synchronisation capabilities.,App URL: https://alternativeto.net/software/joplin/,Page Rank:15,Website Page No:4 
App Name:OpenVPN, Description:OpenVPN is a full-featured open source SSL VPN solution that accommodates a wide range of configurations, including remote access, site-to-site VPNs, Wi-Fi security, and...,App URL: https://alternativeto.net/software/openvpn/,Page Rank:1,Website Page No:6 
App Name:PuTTY, Description:PuTTY is a free and open-source terminal emulator, serial console and network file transfer application.,App URL: https://alternativeto.net/software/putty/,Page Rank:2,Website Page No:6 
App Name:GOG.com, Description:GOG.com (Good Old Games) sells classic PC games through their download service at a low price, without DRM, and updated to run on the latest versions of Windows and other systems.,App URL: https://alternativeto.net/software/gogcom/,Page Rank:3,Website Page No:6 
App Name:Foxit Reader, Description:Free PDF software that enables you to create, annotate, share, and collaborate on PDF documents.,App URL: https://alternativeto.net/software/foxit-reader/,Page Rank:4,Website Page No:6 
App Name:VeraCrypt, Description:VeraCrypt is a free disk encryption software brought to you by IDRIX and that is based on TrueCrypt .,App URL: https://alternativeto.net/software/veracrypt/,Page Rank:5,Website Page No:6 
App Name:AutoHotkey, Description:AutoHotkey is a free, open-source scripting language for Windows that allows users to easily create small to complex scripts for all kinds of tasks such as: form fillers, auto-clicking, macros, etc.,App URL: https://alternativeto.net/software/autohotkey/,Page Rank:6,Website Page No:6 
App Name:Jitsi, Description:Jitsi (previously SIP Communicator) is an audio/video and chat communicator with full encryption that supports protocols such as SIP, XMPP/Jabber, ICQ/AIM, Windows Live, Yahoo!,App URL: https://alternativeto.net/software/sip-communicator/,Page Rank:7,Website Page No:6 
App Name:Simplenote, Description:The simplest way to keep notes.,App URL: https://alternativeto.net/software/simplenote/,Page Rank:8,Website Page No:6 
App Name:Twitter, Description:Twitter is an online social networking service that enables users to send and read short 280-character messages called "tweets".,App URL: https://alternativeto.net/software/twitter/,Page Rank:9,Website Page No:6 
App Name:Tox, Description:Send messages, files, create groups and make Tox to Tox audio and video calls. Securely.,App URL: https://alternativeto.net/software/tox/,Page Rank:10,Website Page No:6 
App Name:Malwarebytes Anti-Malware, Description:Well established and trusted anti-malware solution to help protect against viruses, scams and privacy invasion.,App URL: https://alternativeto.net/software/malwarebytes-anti-malware/,Page Rank:11,Website Page No:6 
App Name:youtube-dl, Description:Augmentable with front-ends such as Youtube-DLG , youtube-dl is a small command-line program to download videos from...,App URL: https://alternativeto.net/software/youtube-dl/,Page Rank:12,Website Page No:6 
App Name:µTorrent, Description:µTorrent is an ad-supported, proprietary BitTorrent client owned and developed by BitTorrent, Inc.,App URL: https://alternativeto.net/software/utorrent/,Page Rank:13,Website Page No:6 
App Name:FFmpeg, Description:FFmpeg is an open source project that develops libraries and programs for handling multimedia data.,App URL: https://alternativeto.net/software/ffmpeg/,Page Rank:14,Website Page No:6 
App Name:Wireshark, Description:Wireshark is the world's foremost network protocol analyzer. It lets you capture and interactively browse the traffic running on a computer network.,App URL: https://alternativeto.net/software/wireshark/,Page Rank:15,Website Page No:6 
App Name:PotPlayer, Description:Minimalist video player that supports 3D video, Direct3D9 Ex Flip Mode, and sound card selection.,App URL: https://alternativeto.net/software/daum-potplayer/,Page Rank:1,Website Page No:7 
App Name:UNetbootin, Description:Cross-platform tool to create bootable Live USB drives with built-in downloader for Linux ISO images and rescue disks.,App URL: https://alternativeto.net/software/unetbootin/,Page Rank:2,Website Page No:7 
App Name:Last.fm, Description:Last.fm is a music community website that offers personalized internet radio, using a recommendation system called "Audioscrobbler" to build a detailed profile of users...,App URL: https://alternativeto.net/software/lastfm/,Page Rank:3,Website Page No:7 
App Name:Affinity Photo, Description:Professional image editing software for desktop and iPad.,App URL: https://alternativeto.net/software/affinity-photo/,Page Rank:4,Website Page No:7 
App Name:WinSCP , Description:WinSCP, a popular free SFTP and FTP client for Windows, copies files between a local and remote computer. It supports also FTPS, SCP and WebDAV. It offers easy to use GUI for all common file operations and a powerfull automation with .NET assembly.,App URL: https://alternativeto.net/software/winscp/,Page Rank:5,Website Page No:7 
App Name:AnyDesk, Description:Remote desktop app for sharing screens and files sharing across most devices focusing on speed and security.,App URL: https://alternativeto.net/software/anydesk/,Page Rank:6,Website Page No:7 
App Name:Plex, Description:Plex bridges the gap between your computer and your home theater, doing so with a visually appealing user interface that provides instant access to your media.,App URL: https://alternativeto.net/software/plex/,Page Rank:7,Website Page No:7 
App Name:IrfanView, Description:Fast, compact image viewer, editor, converter and organizer designed to be simple but powerful.,App URL: https://alternativeto.net/software/irfanview/,Page Rank:8,Website Page No:7 
App Name:Double Commander, Description:Total Commander-inspired file manager that features two side-by-side panels for navigation.,App URL: https://alternativeto.net/software/double-commander/,Page Rank:9,Website Page No:7 
App Name:Eclipse, Description:Eclipse is an extensible development platform with runtimes and application frameworks for building, deploying and managing software across the entire software lifecycle.,App URL: https://alternativeto.net/software/eclipse/,Page Rank:10,Website Page No:7 
App Name:Mozilla Firefox, Description:Mozilla Firefox (known simply as Firefox) is a free and open source web browser descended from the Mozilla Application Suite.,App URL: https://alternativeto.net/software/firefox/,Page Rank:1,Website Page No:1 
App Name:VLC Media Player, Description:VLC is a free and open source cross-platform multimedia player and framework. Owned by the non-profit organization VideoLAN.,App URL: https://alternativeto.net/software/vlc-media-player/,Page Rank:2,Website Page No:1 
App Name:7-Zip, Description:7-Zip is a file archiver with a high compression ratio.The main features of 7-Zip High compression ratio in 7z format with LZMA and LZMA2 compression,App URL: https://alternativeto.net/software/7-zip/,Page Rank:3,Website Page No:1 
App Name:GIMP, Description:GIMP is a free program for such photo retouching, image composition and image authoring. Essentially it's the closest thing to Photoshop you can get for free.,App URL: https://alternativeto.net/software/gimp/,Page Rank:4,Website Page No:1 
App Name:LibreOffice, Description:LibreOffice is a powerful office suite – its clean interface and feature-rich tools help you unleash your creativity and enhance your productivity.,App URL: https://alternativeto.net/software/libreoffice/,Page Rank:5,Website Page No:1 
App Name:Notepad++, Description:Notepad++ is a free source code editor and Notepad replacement that supports several languages.,App URL: https://alternativeto.net/software/notepad-plus-plus/,Page Rank:6,Website Page No:1 
App Name:Visual Studio Code, Description:Code combines the streamlined UI of a modern editor with rich code assistance and navigation, and an integrated debugging experience – without the need for a full IDE.,App URL: https://alternativeto.net/software/visual-studio-code/,Page Rank:7,Website Page No:1 
App Name:Rufus, Description:Easily format and create bootable USB flash drives, such as USB keys/pendrives, memory sticks, etc.
.,App URL: https://alternativeto.net/software/rufus/,Page Rank:8,Website Page No:1 
App Name:qBittorrent, Description:The qBittorrent project aims to provide a Free Software alternative to µTorrent.,App URL: https://alternativeto.net/software/qbittorrent/,Page Rank:9,Website Page No:1 
App Name:Google Chrome, Description:A free web browser developed by Google from the open source Chromium project with a focus on speed and minimalism.,App URL: https://alternativeto.net/software/google-chrome/,Page Rank:10,Website Page No:1 
App Name:Telegram, Description:Telegram is a messaging app with a focus on speed and security. It’s superfast, simple and free. It is like SMS, but more powerful.,App URL: https://alternativeto.net/software/telegram/,Page Rank:11,Website Page No:1 
App Name:Thunderbird, Description:Thunderbird is a free, open source, cross-platform e-mail, news and instant messaging client. The project strategy is modeled after Mozilla Firefox.,App URL: https://alternativeto.net/software/mozilla-thunderbird/,Page Rank:12,Website Page No:1 
App Name:VirtualBox, Description:VirtualBox is a powerful x86 and AMD64/Intel64 virtualization product for enterprise as well as home use.,App URL: https://alternativeto.net/software/virtualbox/,Page Rank:13,Website Page No:1 
App Name:Inkscape, Description:Inkscape is a professional vector graphics editor for Linux, Windows and macOS. It's free and open source.,App URL: https://alternativeto.net/software/inkscape/,Page Rank:14,Website Page No:1 
App Name:Dropbox, Description:Worlds leading online storage and file sync service. You get 2GB free. Apps for all major platforms.,App URL: https://alternativeto.net/software/dropbox/,Page Rank:15,Website Page No:1 
